id,Titel,Body,Kategorie,Datum,Quelle
190,AmorRush: Mit Wiener Start-up zusätzliche Urlaubstage genießen,"Vergessen Sie die Debatten um Karfreitag, persönliche Feiertage, Urlaubstage & Co.! Wenn Sie in der glücklichen Lage sind, noch nicht verheiratet zu sein, dann holen Sie sich zusätzlich zu Ihrem Urlaubskontingent mit einer innovativen Geschäftsidee des Wiener Start-ups AmorRush jetzt ganz einfach, völlig legal und um lediglich € 49,90 bis zu drei Tage Sonderurlaub!Möglich macht’s die Digitalisierungsoffensive der türkis-blauen Regierung, anhand derer immer mehr Amtswege online abgewickelt werden können. Das österreichische Start-up AmorRush hat sich auf zwei dieser neuen elektronischen Services spezialisiert: Digitale Eheschließung und virtuelle Scheidung.Während Sie – je nach Arbeitsvertrag – bis zu drei Tage Sonderurlaub, den Ihnen Ihr Arbeitgeber im Falle einer Eheschließung gewährt, mit Cocktail am Strand oder beim Skifahren in Obertauern genießen, wickelt AmorRush im Hintergrund die nötigen elektronischen Behördenwege für Ihre Kurzzeit-Ehe samt einvernehmlicher Scheidung ab. Dazu müssen Sie dem Unternehmen lediglich vorab eine elektronische Vollmacht erteilen,  so dass die digitalen Behördengänge in Ihrem Namen abgewickelt werden können.Ihr Ehepartner wird dabei aus dem Pool der gerade nicht verheirateten AmorRush-Kunden per Zufallsprinzip ausgewählt. Da die physische Präsenz von Standesbeamten und Bezirksrichtern zur Gänze wegfällt und lediglich ein elektronischer Akt angelegt wird, entfallen sämtliche sonst üblichen Gebüren, so dass AmorRush seine Dienstleistung zum sensationellen Schnäppchenpreis anbieten kann.Worauf warten – holen Sie sich noch heute Ihre zusätzlichen Urlaubstage!","Allgemein, Empfehlung",2019-03-12 00:00:00,Entenpost
191,Schock: 007 bei Mofaunfall ums Leben gekommen,"Steht das Ende der Welt bevor? Dies ist man geneigt zu glauben, denn derzeit jagt eine Promi-Todesmeldung die andere! Innerhalb weniger Tage starben ‚Beverly Hills, 90210‘-Star Luke Perry, Kabarettist Werner Schneyder, The-Prodigy-Frontman Keith Flint, der deutsche Ex-Außenminister Klaus Kinkel – und nun hat es auch noch den wohl bekanntesten Geheimagenten der Welt erwischt: James Bond alias 007 ist tot!Laut Polizeiangaben blieb dem Agenten mit der Lizenz zum Töten, der in der Vergangenheit unzählige Male und stets erfolgreich zur Rettung der Welt ausgezogen war, heute früh um 7:31 Londoner Ortszeit völlig überraschend ein Happy End verwehrt. Bond hatte dem Unfallbericht zufolge in einer nahegelegenen Trafik Zigaretten geholt und befand sich mit seiner Puch Maxi auf dem Rückweg zu seiner Wohnung in Notting Hill. In einer Rechtskurve dürfte er sein Fahrkönnen falsch eingeschätzt haben, verlor trotz trockener Fahrbahn die Kontrolle über sein mit 32 km/h viel zu schnelles Fahrzeug und geriet ins Schleudern.Es wird vermutet, dass der Beamte im Dienste Ihrer Majestät noch nicht ganz munter war, denn Bond, der in früheren, vergleichbaren Situationen die physikalischen Gesetze stets mit souveräner Leichtigkeit außer Kraft zu setzen wusste, touchierte mit seinem Mofa eher unspektakulär ein auf der gegenüberliegenden Fahrbahnseite abgestelltes Fahrrad. Dabei erlitt Bond zahlreiche Abschürfungen sowie eine gebrochene Rippe. Für Bond kam jede Hilfe zu spät, er erlag noch an Ort und Stelle seinen Verletzungen.Sein ehemaliger Widersacher Ernst Stavro Blofeld zeigte sich auf seinem Twitter-Account entsetzt über das Ableben seines doch nicht ewigen Gegenspielers: „Warum musstest du bloß wieder mit diesem Laster anfangen?! Du hättest wissen müssen, dass Rauchen tödlich sein kann! Wir hätten uns noch so viele schöne Duelle liefern können! Weltherrschaft schön und gut, aber ohne dich wird das richtig fad!“Zwar bedeutet der Tod von 007 einen herben Verlust für die globale öffentliche Sicherheit, doch Blofeld, Beißer & Co. sollten sich besser nicht zu früh freuen: Ab sofort übernimmt Austin Powers die Rettung der Welt – shagadelic!","Allgemein, Empfehlung",2019-03-07 00:00:00,Entenpost
192,Konkur­renz für Ama­brush: Kärcher prä­sen­tiert Hoch­druck-Zahn­rei­ni­ger,"Nach dem sensationellen Erfolg der Wunderzahnbürste Amabrush, die das Zähneputzen revolutioniert und in 10 Sekunden erledigt, bekommt das österreichische Start-up nun Konkurrenz von einem echten Schwergewicht in Sachen Reinigungsgeräte: Das Baden-Württemberger Familienunternehmen Kärcher präsentierte einen Hochdruck-Zahnreiniger, der das Zähneputzen zu einem tatsächlichen Highspeed-Ereignis machen soll!Die Hochdruckbürste der 110 bar starken Kärcher ‚Powerbrush‘ bringt es auf eine Leistung von 30 Liter pro Minute und entfernt Speisereste sowie Plaque zuverlässig in durchschnittlich 4 bis 8 Sekunden. Bei jeder Anwendung wird zudem der Speichelfluss und die Durchblutung des Zahnfleisches angeregt, was für eine gesunde Mundflora besonders wichtig ist.Der einzigartige, von Zahnärzten inspirierte Bürstenkopf wird dabei einfach auf den weit geöffneten Mund gepresst und dann per Knopfdruck der Hochdruckwasserstrahl aktiviert. Dieser sorgt zusammen mit den rotierenden Bürsten für porentiefe Reinigung bis in die kleinsten Zahnzwischenräume. Je nach Verschmutzungsgrad und Verfärbungen der Zähne kann im Bedarfsfall zusätzlich auch noch ein Dreckfräser zugeschalten werden.Der austauschbare Li-Ionen-Akku kommt auf eine Laufzeit von 15 Minuten  und reicht mit einer einzigen Akkuladung somit für rund 150 Anwendungen  bzw. 75 Tage! Neben einer kürzeren Putzdauer bietet der Hochdruck-Zahnreiniger von Kärcher im Unterschied zur Amabrush außerdem den Vorteil, dass einfach herkömmliche Zahnpaste verwendet werden kann. Und während die österreichische Wunderzahnbürste bei einigen Anwendern den schalen Eindruck hinterlassen hat, das Gerät mache eigentlich gar nichts, verspricht Kärcher ‚ein höchst intensives Erlebnis, das sich anfühlt wie bei einem Raketenstart‘!Damit dieses umwerfende Feeling auch tatsächlich wiederholt genossen werden kann, sollte man allerdings der Empfehlung des Herstellers nachkommen und vorher durch einen Zahnarzt sicherstellen lassen, dass alle Zähne bombenfest sitzen. Stiftung Warentest ist sich jedenfalls schon mal sicher: Sauberer wird’s nicht!","Allgemein, Empfehlung",2019-03-04 00:00:00,Entenpost
193,Uncle Ben ge­stor­ben: Gat­tin führt Reis-Im­pe­ri­um wei­ter,"Für Reis-Liebhaber war er der Inbegriff der gemeinhin als ‚Weißes Gold‘ bezeichneten Beilage: Uncle Ben! Nun hat der neben Tom und seiner Hütte wohl zweitberühmteste Onkel der Welt im Alter von 97 Jahren mit einer letzten Schale Reis samt Uncle Ben’s Sweet & Sour Sauce völlig friedlich den Löffel abgegeben. Die gute Nachricht: Seine Gattin Jasmin wird das Traditions-Unternehmen in bewährter Manier weiterführen – lediglich an den neuen Namen Aunt Ben’s wird man sich gewöhnen müssen!Uncle Ben – mit bürgerlichem Namen Benjamin Basmati – revolutionierte die Reis-Küche mit dem sogenannten Parboiling-Verfahren: Bei dieser schonenden Vorbehandlung des Reises bleiben die Vitamine und Mineralstoffe im Inneren des Reiskorns erhalten. Ein zusätzlicher Vorteil: Klebriger Reis gehörte damit ein für allemal der Vergangenheit an.Kein Wunder also, dass der Erfolg nicht lange auf sich warten ließ und Uncle Ben’s Reis zur Weltmarke aufstieg. Sogar 72% der Chinesen denken heutzutage beim Ausdruck Reis als allererstes an die orangen Packungen mit dem Konterfeit des freundlich lächelnden Afroamerikaners!Das Unternehmen verliert mit dem Tod von Uncle Ben zwar seinen Gründer und Namensgeber, doch dessen 93-jährige Witwe Jasmin Basmati dürfte allen Anschein nach die Geschicke des Reis-Imperiums übernehmen. Auf ihrem Instagram-Account hat sie jedenfalls bereits erste Fotos der Nachfolge-Marke gepostet und ein schier unglaubliches Versprechen abgegeben: Slow- statt Express-Reis, dafür soll Aunt Ben’s aber offenbar noch schmackhafter werden!","Allgemein, Empfehlung",2019-02-27 00:00:00,Entenpost
194,Österreich nur dritt­sich­er­stes Land: To­des­stra­fe soll er­sten Platz sich­ern,"Österreich gilt als eines der sichersten Länder der Welt – doch der dritte Platz im internationalen Sicherheitsranking ist Türkis-Blau offenbar nicht gut genug. Nach zahlreichen Strafverschärfungen, zusätzlichen Befugnissen für die Nachrichtendienste und der angedachten Sicherungshaft soll nun die Wiedereinführung der Todesstrafe dafür sorgen, dass sich Österreich in puncto Sicherheit endlich ganz nach oben katapultiert.Bundeskanzler Sebastian Kurz zu den neuesten Gesetzesreformüberlegungen der Regierung: „Wir wollen Österreich zum sichersten Land der Welt machen. Die bisherigen Maßnahmen waren dafür leider noch nicht ausreichend. Wir sind daher gezwungen, noch zusätzliche Anstrengungen und weitreichendere Schritte zu unternehmen.“Die Zeit drängt. Innenminister Herbert Kickl und Staatssekretärin Karoline Edtstadler wurden deshalb bereits damit betraut, eine möglichst rasche Lösung für die Wiedereinführung der Todesstrafe auszuarbeiten.Kanzler Kurz in Richtung Bundespräsident Alexander van der Bellen: „Mit Skepsis allein werden wir Neuseeland und Island im Sicherheitsranking sicher nicht überholen! Menschenrechtskonvention hin oder her, das Motto muss lauten: Safety first! Und für dieses Ziel muss und soll uns jedes Mittel recht sein.“Sollte die Todesstrafe wider Erwarten noch immer nicht zum gewünschten Erfolg führen, bliebe laut Innenminister Herbert Kickl nur noch eine Möglichkeit: Die Einführung eines Polizeistaates. Sicherheitshalber werde im Ministerium daran aber ohnehin schon präventiv gearbeitet!",Politik,2019-02-26 00:00:00,Entenpost
195,Tödliche Kuh­atta­cke: Leinen- und Beiß­korb­pflicht für Alm­vieh ge­for­dert,"Das Landesgericht Innsbruck verfügte vor kurzem über einen Tiroler Landwirt eine Geldstrafe im Ausmaß von 490.000 Euro, nachdem seine freilaufenden Kühe im Jahr 2014 auf seiner Alm im Stubaital eine deutsche Touristin attackiert und dabei getötet hatten. Die Killerkühe waren weder angeleint noch trugen diese einen Beißkorb.Um derlei tödliche Unfälle künftig zu verhindern, fordert das Kuratorium für Tourismussicherheit (KFT) die rasche Einführung eines verpflichtenden Kuhführscheins. Dabei sollen den Tieren von besonders aggressiv geltenden Rinderrassen – sogenannte Listenkühe – sowie leicht reizbaren Mutterkühen das korrekte Verhalten und diverse Benimmregeln im freien Gelände beigebracht werden.Außerdem soll ein genereller Leinenzwang sowie eine Maulkorbpflicht für Almvieh dafür sorgen, dass die meist fälschlicherweise als gutmütig eingestuften Bestien nicht länger über Touristen auf querenden Wanderwegen herfallen und diese attackieren können.KFT-Obmann Hermann Ofenröhrl zu den Forderungen seiner gemeinnützigen Organisation: „Schluss mit Laissez-faire in den Alpen, die Sicherheit unserer Gäste muss oberste Priorität haben. Der Tourismus ist und soll schließlich auch weiterhin die Cashcow Nummer eins in unserem Land bleiben!“Und um die Idylle der Almlandschaften zu wahren, so Ofenröhrl, könnte man bei  dieser Gelegenheit wohl gleich auch noch das verpflichtende ‚Sackerl fürs Gackerl‘ einführen, verschandeln doch Kuhfladen allenorts und zuhauf die bis dato unbefleckte Natur!",Allgemein,2019-02-23 00:00:00,Entenpost
196,Als Dank für Kampf gegen IS: Kurz über­reicht Trump Riesen-Mozart­kugel,"Schöne und großzügige Geste von Bundeskanzler Sebastian Kurz zum Abschluss seines Treffens mit Donald Trump: Um die Wertschätzung und Dankbarkeit Österreichs für das Engagement der Amerikaner im Kampf gegen den Islamischen Staat zum Ausdruck zu bringen, überreichte Kurz dem US-Präsidenten im Weißen Haus eine Riesen-Mozartkugel.Dazu Sebastian Kurz im ZIB 2-Interview mit Armin Wolf nach seinem Vieraugengespräch mit Donald Trump: „Wir sind den Amerikanern wirklich sehr dankbar, dass ihre Soldaten im Krieg gegen den IS in Syrien und im Irak tagtäglich ihr Leben riskieren und die USA dafür Milliarden an Dollarn ausgeben. Dem wollten wir Österreicher um nichts nachstehen und uns mit dieser exklusiven Extraanfertigung einer Riesen-Mozartkugel erkenntlich zeigen.“Kanzler Kurz zeigte sich zuversichtlich, dass die Forderung des US-Präsidenten, gefangenen IS-Kämpfer mit österreichischer Staatsbürgerschaft zurückzunehmen, auf Grund dieser generösen Geste vom Tisch sei. Dankbarkeit ja, so Kurz, aber diese habe natürlich auch ihre Grenzen – insbesondere die österreichische!Kleiner Wermutstropfen bei all dem diplomatischen Erfolg: Die Zusage, künftig keine US-Zölle auf österreichische Süßwaren einzuheben, konnte Kurz Donald Trump trotz Riesen-Mozartkugel nicht abringen. Doch was nicht ist, kann noch werden: Dem Vernehmen nach hat Wirtschaftskammer-Präsident Harald Mahrer einen Riesen-Donald-Trump-PEZ-Spender mit im Gepäck!",Politik,2019-02-21 00:00:00,Entenpost
197,Kardinal jubelt: Kar­frei­tag end­lich (halb­tags) frei,"Jahrelang hatte die römisch katholische Kirche darum gekämpft, dass der Karfreitag zum Feiertag erklärt werde. Bis hinauf zum Europäischen Gerichtshof (EuGH) war man gegangen, nun wurde dieser Kampf endlich belohnt: Der Karfreitag wird in Österreich zum halben Feiertag, ab 14:00 haben alle frei!Ein strahlender Kardinal Christoph Schönborn zur türkis-blauen Kompromisslösung: „Klar hätten wir gerne den ganzen Karfreitag frei gehabt, aber wir freuen uns natürlich trotzdem riesig, zumindest einen Halbfeiertag bekommen zu haben. Gerade in der überaus anstrengenden Karwoche kann man so einen halben Tag zum Ausspannen wirklich bestens gebrauchen!“Gegenüber den Kollegen von der evangelischen Kirche und den Altkatholiken habe man sich immer benachteiligt gefühlt: Während diesen am Karfreitag ein Feiertag vergönnt war, schauten die römisch-katholischen Würdenträger durch die Finger und mussten hackeln, so Schönborn: „Das fanden wir ungerecht, daher unser Gang bis zum EuGH, der nun Gott sei Dank Früchte getragen hat!“Halbtags buchen sei zwar nicht ganz einfach gewesen, so Schönborn, dennoch habe er auf booking.com gerade noch ein Last-Minute-Angebot auf Mallorca für Karfreitag ab 14:00 bekommen: „Karfreitag Nachmittag, am Strand, einfach mal blau machen! Dass ich das noch erleben darf ist für mich das wahre Osterwunder! Ich danke dem Herrn. Und dem lieben Gernot Blümel!“Nach der Freude über die ‚Ehe für alle‘ somit die nächste Frohbotschaft für die Kirche – da kommt sogar einem Kardinal ein verfrühtes ‚Hosianna‘ über die Lippen.",Allgemein,2019-02-19 00:00:00,Entenpost
198,Strafe für Minis­te­ri­um: Hin­wei­se auf Tem­po­lim­it und Maß­ein­hei­ten feh­len,"Erst kürzlich wurde eine Kärntner Nudelfabrik gestraft, weil sie auf ihren Verpackungen für Spaghetti & Co. den völlig unzureichenden Zubereitungshinweis ‚8-10‘ und eine Sanduhr aufgedruckt hatte. Dieses Beispiel macht nun offenbar Schule: Die Bezirkshauptmannschaft Melk hat dem Verkehrsministerium eine Strafverfügung übermittelt, in der die ‚höchst unzulänglichen 140er-Taferln‘ auf der A1 beanstandet werden.Eine nackte Zahl reiche definitv nicht aus, so die BH Melk in ihrer Begründung. Erstens, so die Behörde, fehle der dezidierte Hinweis, dass damit ein Tempolimit gemeint sei. Zweitens – das lerne jedes Schulkind spätestens im Physikunterricht – seien bei jeder Größe stets die entsprechenden Maßeinheiten mit anzugeben!Der Melker Bezirkshauptmann Dr. Norbert Haselsteiner: „Sind das jetzt 140 Millimeter pro Minute? Meilen? Knoten? Wir können die Autofahrer ja nicht einfach raten lassen. Hallo, da muss das Verkehrsministerium schon ein bisserl konkreter sein!“Und es sei nicht einmal klar, ob damit nur Autofahrer gemeint seien, so Haselsteiner: „Die Polizei hat vor kurzem einen LKW-Fahrer mit 140 km/h zwischen Melk und Oed geblitzt. Der hat die Bezahlung des Organstrafmandats einfach verweigert, indem er sich darauf berufen hat, dass die 140er-Taferln ohne entsprechenden Zusatzhinweis für alle Verkehrsteilnehmer gelten würden!“623 Euro Strafe muss das Verkehrsministerium binnen der nächsten vier Wochen zahlen. Oder die unzulänglichen Verkehrsschilder umgehend entfernen. Laut Infrastrukturminister Norbert Hofer werde hausintern gerade berechnet, ob sich diese ungeplanten Mehrausgaben im Budget für 2019 noch unterbringen lassen.Sollte allerdings die Bezirkshauptmannschaft Wels-Land zu einer ähnlichen Beanstandung für die Schilder auf der 140er-Teststrecke zwischen Sattledt und Haid kommen, dürfte das Pilotprojekt wohl endgültig vor dem Aus stehen. Im Ministerium hofft man daher nun voll und ganz auf die Vorzüge des Föderalismus und vertraut darauf, dass in Oberösterreich die Vorschriften weniger streng ausgelegt werden als in Niederösterreich.",Politik,2019-02-16 00:00:00,Entenpost
199,ÖSV-Damen bisher leer aus­gegan­gen: Moser-Pröll vor Come­back,"Das bisher enttäuschende Abschneiden unserer Ski-Damen bei der WM in Åre lässt beim ÖSV die Alarmglocken schrillen und die Verantwortlichen zu einer ungewöhnlichen Maßnahme greifen: Die mehrfache Olympia- und WM-Medaillengewinnerin Annemarie Moser-Pröll kehrt kurzfristig in den Ski-Weltcup zurück und soll beim WM-Slalom am Samstag bei den Frauen endlich für österreichisches Edelmetall sorgen!ÖSV-Präsident Peter Schröcksnadel zu der überraschenden Einberufung der sechsfachen Gesamtweltcup-Siegerin: „Die Annemarie ist leider erst vor wenigen Tagen in Pension gegangen, sonst hätten wir diesen längst fälligen Generationenwechsel natürlich schon wesentlich früher vollzogen. Was man bei Svindal und Lindsey Vonn ganz klar gesehen hat: Bei einem Großereignis wie der WM zählt in erster Linie die Erfahrung. Beim Slalom am Samstag wollen wir mit der Annemarie daher ebenfalls auf eine routinierte Läuferin setzen!“Die 65-jährige Moser-Pröll, seit kurzem im Ruhestand und laut eigenen Aussagen daher bereit für neue Aufgaben, zeigte sich gegenüber den Medien zuversichtlich: „Natürlich bin ich ein bisserl aus der Übung, aber das Skifahren verlernt man ja Gott sei Dank nicht. Und zwei Tage Training sollten eigentlich reichen.“ Außerdem, so Moser-Pröll, sei mit den Kippstangen von heute ohnehin alles wesentlich einfacher als damals.Österreichs Sportlerin des Jahrhunderts befindet sich bereits auf dem Weg nach Schweden. Mit im Gepäck hat sie ihre Sieger-Latten und das Erfolgs-Wachs aus den 70er-Jahren. Und jede Menge Freude am Skifahren. Denn ihr Leitspruch ‚Zwoa Brettl a gführiger Schnee, juchhe!‘, so Moser-Pröll, sei bereits die halbe Miete.Bis vor kurzem hatten noch alle mit einer souveränen Titelverteidigung durch Mikaela Shiffrin gerechnet. Mit dem Comeback von Annemarie Moser-Pröll ist das Rennen wieder völlig offen – und Österreichs Chancen auf Gold bei den Damen endlich wieder intakt!",Sport,2019-02-14 00:00:00,Entenpost
200,Zoologische Sen­sa­ti­on: Erst­mals Exis­tenz von Erd­weib­chen nach­ge­wie­sen,"Jahrhundertelang galt es als eines der größten Rätsel im Tierreich: Wie pflanzen sich eigentlich Erdmännchen fort? Dieses Geheimnis könnte nunmehr gelüftet sein, denn dem britischen Tierfilmer und Naturforscher Sir David Attenborough gelang ein Schnappschuss, der offenbar belegen dürfte, dass neben Erdmännchen tatsächlich auch Erdweibchen existieren!Bei diesen Säugetieren aus der Familie der Mangusten, die vor allem für ihre auf zwei Beinen stehende Wächterfunktion bekannt sind, war man bisher davon ausgegangen, dass es ausschließlich männliche Exemplare gibt. Aus diesem Grund erhielten sie auch ihre Bezeichnung Erdmännchen. Wie sich die rein maskulinen Tiere fortpflanzen, stellte die Wissenschaft bis dato vor ein ungelöstes Rätsel.Durch das sensationelle Foto von Sir David Attenborough, das bereits Ende Jänner im südwestlichen Botswana aufgenommen wurde, dürfte mittlerweile allerdings klar sein, dass es neben den männlichen Artgenossen auch weibliche Exemplare gibt, die – so die neueste Theorie – für den Nachwuchs bei den Erdmännchen sorgen.Warum erst jetzt erstmal ein Erdweibchen gesichtet werden konnte, ist noch unklar. Namhafte Zoologen vermuten, dass sich die Erdweibchen auf Grund der auch im Tierreich angekommenen Emanzipation nicht länger mit einer ausschließlichen Mutterrolle unter der Erde abfinden wollen und besonders selbstbewusste Exemplare seit neuestem an die Oberfläche drängen.Wie dem auch sei, eines steht jedenfalls bereits fest: Die Erdmännchen gehören auf Grund dieser Entdeckung wohl bald der Vergangenheit an und eine Umbenennung auf das gendergerechte ‚Erdtierchen‘ dürfte nur noch eine Frage der Zeit sein!","Allgemein, Empfehlung",2019-02-13 00:00:00,Entenpost
201,Faktencheck: Häufung an Krätzen seit Türkis-Blau?,"FPÖ-Politiker Johann Gudenus deutete unlängst in einem Facebook-Posting an, dass es einen Zusammenhang mit der aktuell gehäuften Anzahl an Krätze-Fällen und der Willkommenskultur und der damit verbundenen Migration gäbe. Wie Recherchen ergaben, hält diese These einem Faktencheck jedoch nicht stand. Doch der FPÖ-Klubobmann hat mit seiner Behauptung die Diskussion über eine ander Form der Krätzen-Häufung ins Rollen gebracht: Ist die Anzahl der Krätzen unter den heimischen Politikern regelrecht nach oben geschossen, seit die ÖVP die FPÖ Ende 2017 in der Regierung willkommen geheißen hat?Die Verfechter dieser Theorie stützen sich dabei auf den sogenannten Krätzen-Index. Dieser wird seit Anfang des letzten Jahrhunderts erhoben und spiegelt die von Wählerinnen und Wählern subjektiv empfundene Anzahl an Widerlingen – hierzulande auch als Krätzen bezeichnet – in den Reihen der heimischen Politiker wider. Der Index ist Anfang 2018 geradezu explodiert, sodass von einigen Politbeobachtern neuerdings gemutmaßt wird, dieser Anstieg könne mit dem Zustandekommen von Türkis-Blau zusammenhängen.Doch wie sich herausstellt, hält offenbar auch diese Theorie einem Faktencheck nicht stand, denn Krätzen-Häufungen gab es in der Vergangenheit immer wieder! Die letzte liegt dabei noch gar nicht all zu lange zurück: So konnte beispielsweise in den Jahren 2000 bis 2006 im Krätzen-Index ebenfalls ein bemerkenswerter Ausschlag nach oben verzeichnet werden. Die Behauptung, dass der aktuelle Anstieg auf Türkis-Blau zurückzuführen sei, stimmt also nicht.Die Beispiele zeigen: Mit Krätze-Aussagen sollte man vorsichtig sein. Denn wer leichtfertig und ohne seriöse Recherchen derlei Fake News in die Welt setzt, verliert einerseits im Vertrauensindex – und wird andererseits rasch selbst zur Krätzen!",Politik,2019-02-12 00:00:00,Entenpost
202,Manner-Schnit­ten: End­lich gen­der­ge­rech­te Pa­ckung­en,"Sie galten jahrzehntelang als reine Frauendomäne: Die Manner-Schnitten. Die zartrosa Verpackung ließ nun einmal keinen Zweifel aufkommen, für welches Geschlecht die Waffeln gedacht und gemacht waren. Doch in Zukunft können endlich auch Buben und Männer die vier Lagen Streichmasse zwischen fünf Lagen Waffel genießen: Die Schnitten-Packungen soll es laut Hersteller schon bald auch in Hellblau geben!Manner-Pressesprecherin Roswitha Föhrenwald zu den neuen, gender-gerechten Verpackungen: „Zwar war der Mann im Schriftzug eigentlich immer schon ein bisserl enthalten, aber das Rosa der Verpackung war dann doch zu dominant, so dass im Geschäft praktisch immer nur das zarte Geschlecht zugegriffen hat. Männer konnten unsere Waffeln – wenn überhaupt – höchstens heimlich naschen!“Diesem Gender-Wahnsinn wolle man nun endlich ein Ende setzen, indem die Packungen im Handel sowohl in Rosa als auch in Blau erhältlich sein werden, so Föhrenwald. Naturgemäß erhofft man sich beim Wiener Süßwarenhersteller durch die gegenderten Manner-Schnitten und die damit einhergehende zusätzliche Zielgruppe eine deutliche Absatz-Steigerung. Sollten die Herren der Schöpfung Manner trotz dieser Maßnahme wider Erwarten noch immer nicht mögen, könnte das Wiener Traditionsunternehmen laut Föhrenwald noch einen zusätzlichen maskulinen Touch draufpacken: Blaue ‚Männer-Schnitten‘ samt dem Slogan ‚Manner mag Mann eben!‘","Allgemein, Empfehlung",2019-02-11 00:00:00,Entenpost
