id,Titel,Body,Kategorie,Datum,Quelle
154,Trend: Hunde­tat­toos im­mer be­lieb­ter,"Beim Menschen sind sie mittlerweile schon ein gewohntes Bild: Fast jeder vierte Österreicher hat ein oder mehrere Tattoos, laut einer Studie der Uni Leipzig liegt der Peckerlanteil bei unseren deutschen Nachbarn bei rund 20 Prozent. Nun setzt sich der Trend zur  Haut voller Bilder offenbar auch beim besten Freund des Menschen fort: Hundetattoos werden immer beliebter!Mehr und mehr Vierbeiner wollen es offenbar ihren Frauchen und Herrchen gleichtun und lassen sich tätowieren, so Sebastian Rüdiger, der sich in seinem Tattoo-Salon ‚Stechwastl‘ seit nunmehr zwei Jahren voll und ganz auf Hundetattoos spezialisiert hat. Der Wiener Tätowierer beschäftigt mittlerweile drei Mitarbeiter um die rege Nachfrage nach Hundetattoos stillen zu können.Die Wahl der tätowierten Motive fällt bei seinen Kunden höchst unterschiedlich aus, so Rüdiger: „Je kleiner der Hund, desto furchterregender meist das Motiv. Bei Chihuahuas oder Dackeln liegen beispielsweise feuerspeiende Drachen, zähnefletschende Löwen oder das Konterfeit des aus der Serie Game of Thrones bekannten ‚Bluthund‘ hoch im Kurs.“Größere Hunderassen hingegen tendieren häufig zu chinesischen Symbolen, erotischen Motiven oder auch Sprüchen. Sebastian Rüdiger: „Erst gestern habe ich einer Schäferhündin ‚Jeder Tag ohne Hecheln ist ein verlorener Tag!‘ auf den Hinterlauf tätowiert.“Hoch im Kurs stehen auch die Namen von Herrchen und Frauchen sowie jene der ersten großen Liebe. Rüdiger: „Die Namen Kira und Rocky habe ich mit Sicherheit schon mehr als tausendmal gestochen!“Zwar mache er hin und wieder auch Katzen- oder andere Tiertattoos, so Sebastian Rüdiger, doch Hundetattoos seien ganz klar die Nummer eins. Bei den Bildern auf der Haut gehe es schließlich in erster Linie ums Gesehenwerden, so der Wiener Haut- und Fellkünstler. Und im Unterschied zu Hunden werden nun mal Wellensittich, Schildkröte & Co. eher selten täglich gassi geführt!","Allgemein, Empfehlung",2019-06-25 00:00:00,Entenpost
155,Krasses Sicher­heits­de­sas­ter: Ver­steck­ter Mix­er in Lidl-Mikro­fon ent­deckt,"Dieser Fund verschlug sogar hartgesottenen Sicherheitsexperten die Sprache: In einem Mikrofon des Herstellers Silvercrest, das hierzulande über den Diskonter Lidl vertrieben wird, entdeckten Sicherheitsforscher einen versteckten Mixer. Das via WLAN an das Internet angebundene Mikrofon konnte mit geringem Aufwand gehackt und im Anschluss der heimliche Küchenhelfer ganz einfach aktiviert werden!Das ‚TechMix 31‘ wird als weltweit erstes smartes Mikrofon beworben und soll laut Angaben des Herstellers Silvercrest komplett neue Anwendungen für Bands und Sänger bieten: So sei es beispielsweise möglich, in Echtzeit die eigene Stimme mit einem Song aus dem Internet zusammenzumischen.Sicherheitsexperten warnen allerdings schon länger vor den Risiken, die mit derlei smarten Geräten einhergehen: Die Wartung dieser Geräte werde häufig vernachlässigt und nicht selten kämen völlig veraltete Technologien zum Einsatz.Die beiden französischen Sicherheitsforscher Alexis Viguie und Adrien Albisetti, die das ‚TechMix 31‘ einer genaueren Analyse unterzogen, machten dabei eine schier unfassbare Entdeckung. Alexis Viguie: „Während in vielen smarten Geräten häufig ein verstecktes Mikrofon eingebaut ist, war beim ‚TechMix 31‘ offenbar ein fertig zugekaufter Hardware-Bausatz von Moulinex oder Kennwood mit einem handelsüblichen Mixer integriert!“Den beiden Experten gelang es mit einfachen Mitteln, die Kontrolle über das per WLAN ans Internet angebundene Mikrofon zu übernehmen und in Folge den heimlichen Mixer mit dem simplen Befehl ‚Mixer ein‘ zu aktivieren.So praktisch diese Funktion im Alltag auch sein mag – für Sänger kann sie ein erhebliches Sicherheitsrisiko bedeuten. Der Diskonter Lidl hat glücklicherweise umgehend reagiert und eine Rückrufaktion gestartet: Kunden, die das ‚TechMix 31‘ erworben haben, können dieses ohne Zusatzkosten auf das WLAN-freie und völlig dumme ‚NixMix 21‘ umtauschen!","Allgemein, Empfehlung",2019-06-20 00:00:00,Entenpost
156,Breaking Bad 2: Strache neuer Hauptdarsteller in Fortsetzung der Kultserie,"Während hierzulande das berühmt-berüchtigte Ibiza-Video in erster Linie für politische Schlagzeilen sorgte, schlugen die bisher veröffentlichten Film-Sequenzen mit den beiden Hauptdarstellern Heinz-Christian Strache und Johann Gudenus in Hollywoods Filmbranche geradezu ein wie eine Bombe!Vor allem Vince Gilligan, Schöpfer der TV-Kultserie ‚Breaking Bad‘, dürfte von der Performance der beiden Ibiza-Protagonisten extrem angetan gewesen sein. So sehr, dass der US-amerikanische Erfolgsregisseur für die Fortsetzung seines Drogen-Dramas rund um Walter White und Jesse Pinkman nun den früheren FPÖ-Chef auf der Stelle als neuen Hauptdarsteller von ‚Breaking Bad 2‘ engagiert hat.So schnell kann sich also das Blatt wenden: Schien das Ibiza-Video anfangs das vollständige Karriere-Ende für HC Strache zu bedeuten, entpuppt sich dieses mittlerweile geradezu als Karriere-Sprungbrett für den ehemaligen FPÖ-Spitzenpolitiker.Fernsehproduzent Vince Gilligan, der in ‚Breaking Bad 2‘ neben Drogen, dunklen Geldflüssen und jeder Menge Crime auch noch die unbändige Gier nach Macht aus der Netflix-Serie ‚House of Cards‘ in die Fortsetzung von ‚Breaking Bad‘ einbinden möchte, fand offenbar in Strache die Idealbesetzung für seinen künftigen Hauptdarsteller ‚Chrissie Blue‘. Gilligan: „Das Ibiza-Video war geradezu ein Meisterstück in Sachen Skrupellosigkeit, Drogenkonsum und absolutem Machtrausch! Jemand mit dieser Authentizität haben wir für ‚Breaking Bad 2‘ schon des längeren gesucht. Wir können von Glück reden, dass uns HC nicht jemand wie Quentin Tarantino vor der Nase weggeschnappt hat!“Der frühere FPÖ-Chef wird also weder sein vorzugsstimmen-ermöglichtes EU-Mandat annehmen noch wird er – wie zuletzt des öfteren spekuliert – auf Grund seiner langjährigen Expertise künftig als Drogenbeauftragter für Wien tätig sein: Publikumsliebling HC Strache kehrt fürs erste einmal der Politik den Rücken und der Weg des begnadeten Schauspielers führt – für so manchen Filmkritiker nicht weiter überraschend – schnurstracks nach Hollywood!Ob ‚Joschi‘ Gudenus ebenfalls eine Rolle in ‚Breaking Bad 2‘ spielen wird, muss sich noch zeigen: Der frühere nicht-amtsführende Wiener Stadtrat ist offenbar ein stattliches Salär gewöhnt! Insidern zufolge gehen seine Gehaltsforderungen weit über die üblichen Gagen bekannter Hollywood-Stars hinaus. Doch die Chancen, dass Strache und Gudenus erneut gemeinsam vor der Kamera zu sehen sein werden, stehen gut: Denn in der Handhabung einer Glock stellt Gudenus sogar Klaus Kinski, den größten Western-Schurken aller Zeiten, so richtig in den Schatten!","Allgemein, Politik",2019-06-12 00:00:00,Entenpost
157,Endlich auch für Cabrios: Wunderbaum-Duft ‚Indoor‘ für wohlriechendes Freiluft-Fahrvergnügen,"Die Temperaturen steigen, der Sommer naht – und somit die Hochsaison für Cabriolets! Was gibt es schöneres, als den Fahrtwind am ganzen Leib zu spüren und mittels Freiluft-Tour durchs Land zu brausen. Doch hat der Bauer seine Felder frisch gedüngt oder fährt man länger hinter einem stinkenden Laster her, können einem die unzähligen unliebsamen Düfte rasch die Freude am Open-Air-Ereignis nehmen. Glücklicherweise heißt es für Cabrio-Fahrer nun aufatmen: Vom Lufterfrischer-Hersteller Wunderbaum gibt es ab sofort einen speziell für Cabriolets entwickelten Duftbaum namens ‚Indoor‘!Wie bei konventionellen Wunderbäumen wird auch das Duftbäumchen ‚Indoor‘ am besten am inneren Rückspiegel des Kabrioletts angebracht: Dort sorgt der Lufterfrischer für einen anhaltend wolhriechenden Duft, ganz egal ob Sie mit Ihrem Cabrio gerade an einer Mülldeponie, Kläranlage oder einem Gülle-Feld vorbeifahren.‚Indoor‘ ist laut Hersteller Car-Freshener Corporation eine Mischung aus jenen Gerüchen, die normalerweise im Innenraum eines typischen PKWs vorherrschen. Dabei gibt es länderspezifische Ausprägungen: Die Bayern schätzen beispielsweise einen Hauch Bierfahne während südlichere Länder eher einen intensiven Knoblauch-Duft gepaart mit einer leicht herben Note von Zigarettenrauch bevorzugen.Natürlich lässt sich der speziell für Cabrios entwickelte Duft auch mit herkömmlichen Wunderbäumchen wunderbar kombinieren: Probieren Sie doch einfach einmal ‚Indoor‘ mit einem der Outdoor-Düfte ‚Frühling‘ oder ‚Ocean Paradise‘. Wie auch immer – einer ungetrübten Freiluft-Tour in Ihrem Kabriolett ohne störende Geruchsbelästigung steht ab sofort jedenfalls nichts mehr im Wege!","Allgemein, Empfehlung",2019-06-05 00:00:00,Entenpost
158,Kurz muss zittern: Fritz Neu­ge­bauer kandi­diert mit neuer ‚Beamten Partei‘,"Wird die Wahl am 29. September 2019 doch noch spannend? Gerade erst ist das Datum für den Urnengang bekannt geworden, da sorgt eine neue Meldung für gehörige Aufregung: Offenbar motiviert durch die Popularität der aktuellen Übergangsregierung hat der ehemalige Beamten-Gewerkschafter Fritz Neugebauer bekannt gegeben, als Spitzenkandidat der neu gegründeten ‚Beamten Partei‘ bei der Nationalratswahl antreten zu wollen. Die jetzige Regierung wurde erst Anfang dieser Woche angelobt, doch  Bundeskanzlerin Brigitte Bierlein und ihre handverlesenen Ministerinnen und Ministern genießen bei der Bevölkerung bereits sensationelle Zustimmungsraten. Kein Wunder, sind doch erstmals echte Experten an der Spitze und in den Ministerien am Werk.Dieses Popularitätshoch dürfte den ehemaligen Vorsitzenden der Gewerkschaft Öffentlicher Dienst, Fritz Neugebauer, bewogen haben, bei der Nationalratswahl im Herbst mit einer eigenen Partei zu kandidieren. Der frühere zweite Nationalratspräsident und seine parteiunabhängige ‚Beamten Partei‘, die ausschließlich aus aktiven oder pensionierten Spitzenbeamten bestehen soll, wollen mit dem Slogan ‚Österreich braucht Experten!‘ dafür sorgen, dass nach dem Ausscheiden der jetzigen Übergangsregierung erneut eine Beamtenregierung die Geschicke dieses Landes lenkt – allerdings demokratisch legitimiert.Fritz Neugebauer hat in der Vergangenheit schon des öfteren die eine oder andere Partei das Fürchten gelehrt. Zwar liegen Sebastian Kurz und seine ÖVP in Umfragen derzeit klar auf Platz 1. Doch bis zum 29. September ist noch ein langer Weg. Und die ersten Wahlplakate der Beamten Partei sehen schon einmal richtig vielversprechend aus. Muss Kurz am Ende gar um seine Wiederwahl zittern?! Sommer und Wahlkampf versprechen jedenfalls heiß zu werden!",Politik,2019-06-04 00:00:00,Entenpost
159,Drei von vier gingen zum Schmiedl: SPÖ bringt Miss­trauens­antrag gegen Wäh­ler ein,"‚Dieses Wahlvolk hat nicht länger unser Vertrauen!‘ – so lautete das Fazit der mehrstündigen Beratungen des SPÖ-Bundesparteipräsidiums noch gestern Nacht: Mehr als drei Viertel der Bürgerinnen und Bürger hatten bei der EU-Wahl ihr Kreuz nicht bei den Sozialdemokraten gemacht! Die Parteiobfrau der SPÖ, Pamela Rendi-Wagner kündigte deshalb an, in der heutigen Nationalratssitzung einen Misstrauensantrag gegen die Wählerinnen und Wähler einzubringen.Ein Skandal-Video bringt die Regierung von ÖVP und FPÖ wenige Tage vor der EU-Wahl zu Fall und beschert dem Land eine Regierungskrise. Daraufhin sprachen nicht wenige Polit-Beobachter nicht nur von einem aufgelegtem Elfmeter für die SPÖ als größte Oppositionspartei, sondern gar von einem Elfer ganz ohne Tormann!Doch nicht einmal ein Viertel aller Stimmen konnte die SPÖ am gestrigen Wahltag für sich gewinnen. Mit durchaus selbstkritischen Worten brachte der burgenländische Landeshauptmann Hans-Peter Doskozil das Wahlergebnis auf den Punkt: „Nur einer von vier Österreichern entschied sich gestern für den Schmied, die restlichen drei Wappler gingen dieses Mal – aus welchen Gründen auch immer – zum Schmiedl!“Das, so SPÖ-Parteivorsitzende Rendi-Wagner, sei leider keine vertrauensbildende Maßnahme des Wahlvolkes gewesen: „Wir Sozialdemokraten können und werden da nicht einfach zur Tagesordnung übergehen. Deshalb haben wir gestern im Präsidium einstimmig beschlossen, am Montag im Parlament einen Misstrauensantrag gegen die Wählerinnen und Wähler einzubringen. Samt Forderung nach einer Neuaustragung der Wahl!“Die Chancen, dass der Antrag eine Mehrheit finden könnte, stehen nicht schlecht: Mit Ausnahme der ÖVP sehen auch die anderen Parteien das Stimmverhalten der Österreicherinnen und Österreicher bei der gestrigen Europa-Wahl durchaus kritisch. Die Liste Jetzt hat jedenfalls schon einmal angekündigt, den Antrag der SPÖ unterstützen zu wollen.Wenn es tatsächlich zur Neuaustragung der Wahl kommt, sollten die Wählerinnen und Wähler alles daran setzen, das Vertrauen der Parteien schnellstmöglich wieder zurückzugewinnen – denn nur so funktioniert nun einmal Demokratie!",Politik,2019-05-27 00:00:00,Entenpost
160,Aufregung um heimlich gefilmte Tali­ban-An­schlags­pläne: Gott sei Dank nur ‚bsoffene Gschicht‘,"Das Ibiza-Video mit HC Strache und Johann Gudenus ist noch in aller Munde, da sorgt bereits ein weiteres heimlich aufgenommenes Video für eine Welle der Empörung in den sozialen Medien: Mehrere afghanische Taliban wurden mit versteckter Kamera und völlig ohne deren Zustimmung dabei gefilmt, wie sie potentielle Anschlagspläne und -ziele in Österreich besprechen!Das Treffen wurde offenbar von einem fingierten Waffenhändler eingefädelt, der den Taliban Kriegsgerät im Wert von 250 Millionen Euro in Aussicht stellte. In dem sechsstündigen Video, aus dem bisher nur vereinzelte Ausschnitte veröffentlicht wurden, werden konkrete Pläne gewälzt, wie in Österreich ein Gottesstaat errichtet und ein Anschlag auf das Hauptorgan der Ungläubigen, die Kronen Zeitung, verübt werden könne.Der falsche Waffenhändler präsentierte bei dem Treffen den Islamisten unter anderem auch österreichische Steyr AUG Sturmgewehre und Munition. Einer der heimlich gefilmten Macho-Taliban ist dabei mit dem begeisterten Ausruf ‚Bist du deppert, ist die scharf! Mit diesem geilen Zeugs geht das alles zack, zack, zack!‘ zu hören.In den sozialen Medien entlud sich so wie schon bei dem Filmmaterial aus Ibiza neuerlich jede Menge Unmut und Zorn über das offensichtlich illegal verfasste Video: ‚Muss sich ab sofort jedermann fürchten, dass er in eine Falle gelockt und heimlich und überall gefilmt wird?!‘, fragt etwa auf Facebook User Marten Schett, dem Datenschutz über alles geht. ‚Bevor ich nicht das gesamte Video gesehen habe, besteht für mich die Unschuldsvermutung!“ oder ‚Da stecken sicher die Juden und Tal Silberstein dahinter!‘, so einige der entrüsteten Kommentare.Doch wie sich mittlerweile herausgestellt hat, dürfte die Aufregung ohnehin umsonst gewesen sein, denn bei der Besprechung der Taliban war offenbar jede Menge Alkohol – und wohl auch Opium – im Spiel, so dass bei den heimlich gefilmten Anschlagsplänen der Islamisten Gott sei Dank nur von einer ‚bsoffenen Gschicht‘ auszugehen ist. Mit einem Wort: Nix is‘ g’schehn, alles gut! Dennoch muss man sich mittlerweile fragen: Ist eigentlich noch irgendwer sicher vor derlei dreisten, versteckten Filmaufnahmen!",Politik,2019-05-21 00:00:00,Entenpost
161,Nächster Diesel-Skandal: Biodiesel in Wahrheit gar nicht Bio!,"Der Diesel kommt nicht aus den Schlagzeilen: Waren die illegalen Abschalteinrichtungen, die Autohersteller wie VW oder Audi in ihren Dieselfahrzeugen eingebaut hatten, um Abgaswerte zu schönen, schon eine bodenlose Frechheit, schlägt dieser Skandal dem Fass wohl endgültig den Boden aus: Bei einem Öko-Test der Umweltschutzorganisation Global 2019 konnte nachgewiesen werden, dass Biodiesel zum überwiegenden Teil überhaupt nicht Bio war!Umweltbewusste und auf Nachhaltigkeit setzende Autofahrer sind fassungslos: Wo Bio draufsteht, sollte doch eigentlich auch Bio drin sein! Doch die Ergebnisse des Öko-Tests, die Mitte der Woche von Global 2019 veröffentlicht wurden, sind geradezu ernüchternd: Unmengen an Pestizid-Rückständen und reihenweise Spritzgifte, die in Bio-Produkten aber sowas von gar nichts verloren haben!Detlev Brüderle, Leiter der von Global 2019 durchgeführten Biodiesel-Analysen: „Die Rückstände, die wir in den untersuchten Treibstoffen gefunden haben, überschreiten die gesetzlich vorgeschriebenen Grenzwerte für Bio-Produkte um ein Vielfaches! Sie zeigen ganz klar, dass für die Treibstoffherstellung zum überwiegenden Teil Pflanzen aus konventioneller Landwirtschaft verwendet wurden. Bei diesen Messwerten kann man eigentlich gar nicht mehr von einem Bio-Schmäh sprechen – das ist schon vielmehr eine regelrechte Bio-Verarsche!“Da tankt so mancher in bester Absicht Biodiesel – und in Wahrheit qualmt aus dem Auspuff Glyphosat & Co.! Dieselgate, Dieselfahrverbote – und jetzt auch noch der Biodieselskandal. Dieselfahrer haben’s derzeit nicht gerade leicht. Vielleicht sollte einfach mal jemand Super-Benzin untersuchen: Wer weiß, unter Umständen ist der ja auch nicht so positiv wie der Name vermuten lässt!","Allgemein, Empfehlung",2019-05-17 00:00:00,Entenpost
162,Kadaveran: Fleisch mit gu­tem Ge­wis­sen ge­nie­ßen,"Wer eigentlich ganz gerne Fleisch essen würde, jedoch bisher zum Vegetarier verurteilt war, weil ihm das Töten und Abschlachten von Tieren Gewissensbisse verursachte, für den gibt es nun Abhilfe: Kadaveran heißt der neueste Essens-Trend aus den USA, bei dem lediglich das Fleisch von Tieren gegessen wird, die ohne menschliches Zutun das Zeitliche gesegnet haben!Dorli war ein durch und durch glückliches Mangalitza-Schwein und wurde 16 Jahre alt, ehe es auf seinem Bauernhof im Kärntner Lavanttal im Kreise seiner engsten Angehörigen friedlich von dannen ging. Auch Kuh Mona war bereits beachtliche 22, als die mehrfache Mutter und Großmutter nach einem erfüllten Rinderdasein ihren letzten Atemzug tat.Weniger Glück hatte Bergschaf Brünna, das bei einem Unwetter vom Blitz getroffen wurde, sowie Henne Hilda, die vorzeitig der Geflügelpest erlegen war.Sie alle eint, dass ihnen der Schrecken eines Schlachthofs und somit das grausame Schicksal zigtausender ihrer Artgenossen erspart geblieben ist, ehe sie als Schnitzel, Steak & Co. auf dem Teller landeten – und zwar auf den Tellern von Kadaveranern: Menschen, die zwar Fleisch essen, allerdings nur von Tieren, die nicht der Tod durch das Schlachtbeil ereilt hat!Der Kadaveran-Food-Trend aus den USA findet auch hierzulande immer mehr Anhänger. Zwar ist das Fleisch nicht immer ganz so zart wie das von konventionell geschlachteten Tieren, doch das nehmen offenbar viele – insbesondere bisherige Vegetarier – für einen Fleischgenuss ohne ethische Bedenken gerne in Kauf.Wer im Supermarkt oder beim Fleischer auf Nummer sicher gehen möchte, der achtet am besten auf das AAS-Gütesiegel: Bei diesem neuesten Zertifikat der Agrarmarkt Austria wird mittels Leichenbeschau eines beeideten Veterinärs der natürliche Tod der Tiere bestätigt.Gelsenbisse bei Ihrer Grillparty lassen sich nicht immer vermeiden – Gewissensbisse sehr wohl!","Allgemein, Empfehlung",2019-05-12 00:00:00,Entenpost
163,Ein Herz für Insekten: Vogel­sil­hou­et­ten von Car­glass sol­len Bie­nen & Co. das Le­ben ret­ten,"Dramatische Zahlen präsentierte der Weltbiodiversitätsrat der Vereinten Nationen kürzlich in seinem Bericht zur Artenvielfalt: Demnach sind allein in den letzten drei Jahrzehnten fast 80% aller Insekten verschwunden! Schuld am exorbitanten Insektensterben sind in erster Linie die Autofahrer, wie der Blick auf die Windschutzscheibe nach einer Ausfahrt im Sommer eindrucksvoll beweist. Für all jene, die nicht länger tatenlos zusehen möchten, gibt es nun Abhilfe: Die Firma Carglass hat ab sofort Vogelsilhouetten in ihrem Sortiment, die Insektenschlag bei Autos zuverlässig verhindern sollen.Laut Hersteller sind die auf den Aufklebern abgebildeten, Insekten fressenden heimischen Vögel ihren echten Artgenossen täuschend ähnlich und erzeugen dadurch bei Käfer, Grashüpfer, Schmetterling & Co. die gewünschte abschreckende Wirkung! Tests in der Werkstatt, so Carglass, hätten eindrucksvoll gezeigt, dass Insekten offenbar einen großen Bogen um Fahrzeuge mit den aufgebrachten Warnvögeln machen würden.Wer ein ganz besonderes Herz für Insekten hat, greift noch etwas tiefer in die Tasche und lässt sich die Vogelsilhoutte nicht nur vorne sondern auch hinten auf die Heckscheibe kleben. So verhindern echte Tierliebhaber auch beim Rückwärtsfahren mit ihrem Auto zuverlässig den grausamen Massenmord an den kleinen Flugobjekten.Und vielleicht haben ja nicht nur die Insekten etwas von den Aufklebern: Sollte Ihr Auto mit Vogelsilhouette künftig wegen Zu-Schnellfahrens von einem Radar geblitzt werden, dann schieben Sie die Schuld doch einfach auf einen der abgebildeten Vögel. Denn wie der Vorfall mit einer Taube in der nordwestdeutschen Stadt Bocholt zeigt, sind Vögel offenbar gelegentlich schneller unterwegs als erlaubt!","Allgemein, Empfehlung",2019-05-08 00:00:00,Entenpost
164,Tesla-Hybrid: Mit integriertem Diesel-Generator unabhängig von explodierenden Strompreisen,"Die Anschaffungskosten für ein Elektroauto sind ohnehin schon nicht gerade gering. Und jetzt soll auch noch Stromtanken teurer werden als Benzin und Diesel!? Um sich den Preis-Schock an der E-Zapfsäule zu ersparen und dennoch weiterhin CO2-frei unterwegs sein zu können, bringt der US-amerikanische Elektroautohersteller Tesla nun eine Hybrid-Variante namens ‚Model H‘ auf den Markt: Dabei erzeugt ein integrierter Diesel-Generator den umweltfreundlichen Strom für den Antrieb des emissionsfreien Elektromotors.Tesla bleibt somit auch beim Model H seiner 100% Elektrofahrzeug-Linie treu. Im Unterschied zu allen bisherigen Modellen kommen die Tesla-Hybrid-Autos jedoch gänzlich ohne die häufig als umweltschädlich verunglimpften Akkus aus: Das integrierte Dieselaggregat erzeugt den Strom für den Elektromotor im Model H zur Laufzeit, was den völligen Verzicht auf die sonst üblichen Lithium-Ionen-Batterien ermöglicht.Durch das Fehlen des 600 Kilogramm-Akkus ist das Model H außerdem wesentlich leichter als beispielsweise das über zwei Tonnen schwere Tesla Model S. Die geringere Masse wirkt sich entsprechend positiv auf die Energiebilanz aus. Und noch etwas macht den Tesla-Hybrid umweltfreundlicher als all seine Vorgängermodelle: Da man beim Model H gewöhnlichen Diesel statt Strom tankt, erspart man sich zur Gänze die leidigen Fahrten zur E-Tankstelle!Wer somit auch künftig mit grüner Nummerntafel und trotzdem kostengünstig unterwegs sein möchte, dem bietet das Tesla Model H eine ideale Alternative zu all jenen Elektrofahrzeugen, die der Preiswillkür an der E-Zapfsäule hilflos ausgeliefert sind! Wer es weniger klimafreundlich braucht, aber ebenfalls preisliche Unabhängigkeit schätzt, dem sei der Actros XL von Mercedes ans Herz gelegt!","Allgemein, Empfehlung",2019-05-07 00:00:00,Entenpost
165,Passwörter: ***** löst 12345 als Lieblings-Kennwort ab,"Lange Zeit galt 12345 als weltweit beliebtestes Passwort im Internet: Einfach zu merken, leicht auf der Tastatur einzugeben – das waren wohl die Hauptgründe dafür, dass dieses Kennwort rund um den Globus so gerne und häufig eingesetzt wurde.Doch Sicherheitsbedenken haben zuletzt dazu geführt, dass 12345 bei vielen Webseiten und in Apps immer öfter und nicht länger akzeptiert wird. Begründet wird dies mit dem Fehlen eines oder mehrerer Sonderzeichen, die modernen Passwort-Crackern das Leben schwer machen. Heutzutage wird bei Google, Instagram & Co. daher meist mittels Passwort-Richtlinie mindestens ein Sonderzeichen zwingend bei der Vergabe neuer Passwörter vorausgesetzt.Eine aktuelle Online-Umfrage des europäischen Meinungsforschungsinstituts ‚Hoaxpost Research‘ hat nun ergeben, dass aus diesem Grund offenbar immer mehr Benutzer von 12345 auf ***** umsteigen. Der Stern gehört zu den Sonderzeichen und erfüllt somit die eingangs erwähnte strengere Passwort-Richtlinie. Fünf Sterne bedeuten zudem gleich fünf Sonderzeichen: Die Kennung wird dadurch extrem sicher und ist auch mit modernster Technologie praktisch unknackbar!Weiters hat ***** praktischerweise die selbe Länge wie 12345 und lässt sich ähnlich leicht merken wie die ersten fünf Ziffern. Und neben der erhöhten Sicherheit bietet der Fünffach-Stern gegenüber dem bisherigen Lieblings-Passwort außerdem noch einen weiteren Vorteil, vor allem auf den oftmals ziemlich klein-geratenen Smartphone-Tastaturen: Bei der Eingabe von ***** sieht man nämlich sofort, ob man sich vertippt hat oder nicht!Kein Wunder also, dass der Fünffach-Stern laut Hoaxpost Research mittlerweile bei sechs von zehn Usern als sichere Alternative zum bisherigen 12345 verwendet wird. Sollten Sie noch irgendwo die Ziffernfolge als Passwort einsetzen, dann steigen Sie lieber heute als morgen um. Böse Hacker lauern überall, geben Sie ihnen nicht leichtfertig eine Chance!","Allgemein, Empfehlung",2019-05-02 00:00:00,Entenpost
