id,Titel,Body,Kategorie,Datum,Quelle
228,Popwelt trauert: Elvis Presley ist tot,"Das neue Jahr ist erst wenige Tage alt und hat doch bereits seinen ersten prominenten Todesfall: Elivs Presley, King of Rock ’n’ Roll, ist tot! Die Musikwelt zeigt sich geschockt ob des unerwarteten Ablebens des Musikers, galt der 83-Jährige doch vielen schlicht als unsterblich!Laut seinem Management sei Presley, der gerade an einem neuen Song für den US-Rapper Snoop Dogg gearbeitet habe, am 3. Jänner kurz nach 13:00  von seiner Ehefrau Ginger Alden in seinem Tonstudio auf seinem Anwesen Graceland in Memphis leblos aufgefunden worden. Als Todesursache wird plötzlicher Herztod vermutet, den seine langjährige Erkrankung an Morbus Hirschsprung ausgelöst haben könnte.Presley prägte mit seiner Musik nicht nur Generationen von Rock ’n‘ Roll-Musikern, sein Einfluss ist auch in vielen anderen Genres massiv zu spüren: Bands wie Kraftwerk oder Take That wären ohne die Ikone Elvis Presley undenkbar gewesen.Nur wenige Tage vor seinem 84. Geburtstag, an dem Elivs Presley wie alle Jahre der eigenen Gedenkveranstaltung anlässlich seines immer wieder von Verschwörungstheoretikern kolportierten Todes im Jahr 1977 beiwohnen wollte, trauert die Musikwelt um einen der Größten ihrer Branche. Musiker-Kollege Prince bringt es auf seinem Twitter-Account auf den Punkt: „Heute haben wir eine musikalisch Ikone verloren: Er war ein virtuoser Instrumentalist, ein brillanter Sänger und ein elektrisierender Bühnenkünstler. Elvis war und wird immer mein Idol sein, RIP!“Für eingefleischten Elvis-Fans ist jedenfalls eine Welt zusammengebrochen. Einige von ihnen wollen der Todesnachricht allerdings offenbar nicht so recht trauen und sprechen von geschmacklosen Fake News bzw. einer unglaublichen Verschwörungstheorie. Denn für sie steht eines nach wie vor fest: Der King lebt!",Allgemein,2019-01-04 00:00:00,Entenpost
229,Neujahrskonzert: Kurz fängt letztes fehlendes Pokémon,"Das neue Jahr hat mit einem privaten Erfolgserlebnis für Sebastian Kurz begonnen: Beim Neujahrskonzert gelang es dem Bundeskanzler, endlich ein Dragoran zu fangen – das einzige Pokémon, das ihm bis dato noch gefehlt hatte. Das dürfte auch erklären, warum sich der 32-Jährige zur Überraschung des Publikums mitten in der Bajadere, einer schnellen Polka von Johann Strauß, zu einer Solo-Standing-Ovation hinreißen ließ.Sebastian Kurz schildert im Interview mit der APA die dramatischen Momente während des Konzerts im Musikverein: „Am Anfang lief es eigentlich gar nicht gut. Beim dritten Stück, irgend so ein Strauß-Dings, lieferte ich mir einen Arena-Kampf mit diesem Japaner, der zwei Reihen vor mir saß. Aber der war echt gut und hatte einfach die besseren Reflexe, und dann übersah ich diesen einen gelben Blitz und ich konnte leider meinen Spezialangriff nicht mehr einsetzen!“Eine herbe Enttäuschung für den Kanzler, hatte dieser doch in den letzten Monaten während der Nationalratssitzungen hart an seinen Reaktionen und Movesets gearbeitet! Doch die Enttäuschung währte nicht lange: Als Christian Thielemann wenig später die Bajadere dirigierte, tauchte plötzlich völlig unverhofft ein extrem seltenes Dragoran-Pokémon auf – und nun sollte sich das unermüdliche Training der letzten Wochen bezahlt machen: Das einzige noch in seiner Sammlung fehlende Pokémon war gegen Kurz‘ präzise geworfene Pokébälle schlicht chancenlos.In seiner Euphorie riss es den Kanzler förmlich vom Hocker. Seine Solo-Standing-Ovation wurde von der Bild-Zeitung folgendermaßen interpretiert: „Sebastian Kurz, ein leidenschaftlicher Politiker, der nicht davor scheut, seine Emotionen auch in der Öffentlichkeit zu zeigen. Genau das ist est, was unserer Kanzlerin fehlt!“",Politik,2019-01-02 00:00:00,Entenpost
230,‚Ehe für alle‘: Jetzt können auch katholische Priester heiraten,"Mit großer Vorfreude wurde dieses Mal in Kirchenkreisen der Silvesternacht und dem Jahreswechsel entgegengefiebert! Denn seit dem Neujahrstag ist es endlich soweit: Die ‚Ehe für alle‘ ist besiegelt. Das Zölibat ist damit Geschichte und nach Jahrhunderten der Entbehrung können hierzulande endlich auch katholische Priester und Ordensleute den Bund der Ehe schließen!Dementsprechend groß war der Jubel und die Erleichterung unter den katholischen Geistlichen in ganz Österreich um Punkt Mitternacht am Silvestertag: Möglich machte dies ein Urteil des Verfassungsgerichtshofes (VfGH). Dass auch der katholische Klerus von der ‚Ehe für alle‘ umfasst ist, begründete der Verfassungsgerichtshof mit dem Diskriminierungsverbot des Gleichheitsgrundsatzes.Dazu der Präsident des VfGH, Gerhard Holzinger, in einer schriftlichen Stellungnahme: „Laut Artikel 14 der euorpäischen Menschenrechtskonvention darf niemand auf Grund seiner Religion oder Weltanschauung diskriminiert werden. Das Eheverbot für Priester einzig und allein auf Grund ihrer Zughörigkeit zur katholischen Kirche widerspricht ganz klar diesem Grundsatz. Es war daher höchst an der Zeit, die Diskriminierung durch den Zölibat zu beseitigen.“Österreich ist durch das Urteil des VfGH das weltweit erste Land, in dem die ‚Ehe für alle‘ tatsächlich wortwörtlich genommen wird. Auch für Nonnen und Mönche ist durch den Urteilsspruch die Ehe ab sofort möglich. Doppelt groß ist die Freude naturgemäß unter homosexuellen Priestern: Laut dem ehemaligen Priester Krzysztof Charamsa immerhin rund die Hälfte aller katholischen Geistlichen!Überaus euphorisch zeigte sich auch Kardinal Christoph Schönborn in seiner Neujahrspredigt: „Wir weisen schon seit vielen Jahren auf diese Ungleichheit und Benachteiligung katholischer Geistlicher hin. Mir fehlt fast der Glaube, dass wir das schier Unmögliche nun endlich geschafft haben! Dieses Urteil gleicht einem nachträglichen Weihnachtswunder und wir werden noch heute am Stephansdom die Regenbogenflagge hissen! Bleibt nur noch zu hoffen, dass diese Frohbotschaft eines Tages auch bei unseren lieben Freunden im Vatikan ankommt und dort auf fruchtbaren Boden fällt.“",Allgemein,2019-01-02 00:00:00,Entenpost
231,Nach Heirat: Peter Pilz heißt jetzt Jetzt,"Heute Vormittag war es endlich soweit: Peter Pilz gab seiner langjährigen Lebensgefährtin Gudrun Jetzt das Ja-Wort – und nahm dabei den Nachnamen seiner nunmehrigen Ehefrau an. In Zukunft heißt der oberste Aufdecker und Mister U-Ausschuss somit Peter Jetzt!Der Nationalratsabgeordnete und frischgebackene Ehemann zur Entscheidung, den Namen seiner Frau als gemeinsamen Familiennamen anzunehmen: „Wenn du Pilz heißt, ist das natürlich eine aufgelegte Sache: Schon in der Volksschule hieß es immer ‚Schaut’s, da kommt das Schwammerl‘ – und das hat sich fortgesetzt bis ins Parlament!“Der Name Jetzt sei zwar auch nicht das Gelbe vom Ei, so der ehemalige Grünen-Politiker, aber einerseits sei er dadurch nicht länger das Schwammerl der Nation, und andererseits wolle er damit zeigen, dass er ein moderner, aufgeschlossener Mann sei, der Frauen durchaus als annähernd gleichberechtigte Objekte betrachte.Nicht nur an den neuen Namen Peter Jetzt werden sich die Medien und politisch Interessierte gewöhnen müssen, auch die Oppositionspartei JETZT dürfte wohl eine neue Bezeichnung bekommen. Dazu Parteigründer Peter Jetzt: ‚Wir müssen uns möglichst bald einen neuen Namen überlegen, denn es darf auf keinen Fall der Eindruck entstehen, es handle sich bei der Partei um eine reine One-Man-Show“. Der Steirer favorisiert dem Vernehmen nach etwas Englisches als neue Bezeichnung: ‚The Peter Team‘ hätte beispielsweise Charme, so der ehemalige Liste-Pilz-Gründer.Wie auch immer: Gudrun und Peter an dieser Stelle herzlichen Glückwunsch und alles Gute für ihren gemeinsamen Lebensweg!",Politik,2018-12-29 00:00:00,Entenpost
232,Himmlisches Man­ner: Ver­trag mit Wie­ner Tra­diti­ons­un­ter­neh­men ver­längert,"Aufatmen beim Wiener Süßwarenhersteller Manner und seiner Belegschaft: Der mehr als 2000 Jahre alte Vertrag über die Lieferung von Manner ans Himmelreich konnte um weitere 500 Jahre verlängert werden. Zusätzlich zu den Manner-Schnitten werden künftig auch Dragee-Keksi und Casali Rumkugeln im Lieferumfang enthalten sein.Der jahrtausendealte Vertrag mit Manner, der Anfang dieser Woche ausgelaufen ist, geht auf die 40-jährige Wanderung der Israeliten durch die Wüste zurück. Gemäß zweitem Buch Mose im Alten Testament ließ der Herr nachts Manner – etwas Feines, Knuspriges – vom Himmel regnen, damit Moses und sein Volk nicht zu hungern hatten.Die wahrlich göttlichen Haselnuss-Waffeln, auch als Himmelsbrot bezeichnet, werden seit jener Zeit von Manner am Standort Wien hergestellt und in den praktischen Viererpackungen ans Himmelreich geliefert. Diese langjährige Tradition dürfte mit der Vertragsverlängerung für zumindest weitere 500 Jahre gewährleistet sein und sichert gleichzeitig für mehrere Generationen hunderte Arbeitsplätze beim österreichischen Süßwarenhersteller.In zähen Verhandlungen konnte sich Manner dabei gegen die Konkurrenzprodukte Twix und Oreo behaupten. Zwar musste man beim Preis ein paar Abstriche in Kauf nehmen, dafür konnte der Lieferumfang um die auch zum Konzern gehörigen Dragee Keksi und – für besondere Anlässe – Rum-Kokos von Casali erweitert werden. Und weil man nicht nur hüben sondern auch drüben verstärkt auf bewusste Ernährung setzt, soll ein Teil der Manner-Schnitten künftig in der Vollkorn-Variante geliefert werden. Wie auch immer: Manner mag man eben!","Allgemein, Empfehlung",2018-12-26 00:00:00,Entenpost
233,Wieder keine Weißen Weih­nach­ten: Hart­lauer-Schnee­wette schuld?,"Abgesehen vom Heiligen Land Tirol hat es also auch heuer wieder nicht geklappt! Weiße Weihnachten wird immer mehr zum Fremdwort, jüngere Generationen haben es noch gar nie erlebt. Lange Zeit blieb es ein Rätsel,  warum eine verschneite Winterlandschaft zu Weihnachten hierzulande immer mehr zum Schnee von gestern geworden ist. Doch nun dürfte die Ursache für das Ausbleiben der weißen Pracht im Dezember gefunden worden sein: Die Hartlauer-Schneewette!1994 war Franz Josef Hartlauer einer der ersten Unternehmer, der die Feiertagsruhe zu Mariä Empfängnis am 8. Dezember durchbrach. 1997 schließlich führte der mittlerweile verstorbene Firmengründer die Schneewette ein: Wenn es vor dem Rathaus der Landeshauptstadt, wo der Kauf getätigt wurde, am 24. Dezember um 12 Uhr mittags schneit, erfolgt eine Rückerstattung der getätigten Einkäufe.In Kirchenkreisen und insbesondere bei Hardcore-Katholiken hat sich daher zuletzt der Glaube verfestigt, dass eine an Blasphemie grenzende Missachtung eines christlichen Adventfeiertages und gar ein Glücksspiel an Heilig Abend naturgemäß den Zorn des Herrn hervorrufen würden. Für sie ist es erwiesen: Es braucht keine kruden Klimawandel-Verschwörungstheorien! Die viel zu milden Temperaturen am Punschstand und verregnete Weihnachtsfeiertage gehen eindeutig auf die Machenschaften des Foto-, Optik-, Hörgeräte- und Elektronikhandelsunternehmens mit Sitz in Steyr zurück und sind die gerechte Strafe Gottes!Wer sich Weiße Weihnachten wie anno dazumal in Bethlehem wünscht, der gehe daher am 8. Dezember in die Kirche statt shoppen – und kaufe Handy, Kamera & Co. so wie früher beim Niedermeyer.",Allgemein,2018-12-25 00:00:00,Entenpost
234,FC Bayern: Tweet von Lisa Müller brachte Wende,"Von Donald Trump weiß man, welche Wellen seine Tweets schlagen können. Auch eine Twitter-Nachricht von Thomas Müllers Gattin Lisa beim Spiel des FC Bayern München gegen den SC Freiburg am 10. Spieltag der deutschen Bundesliga ließ die Wogen hochgehen. Doch während die Tweets des US-Präsidenten oft aus dem Effekt heraus geschrieben sind, handelte es sich bei Lisa Müllers Tweet um eine messerscharfe Analyse der vorangegangenen 70 Minuten. Diese bis dato völlig außer Acht gelassene Expertise der Spielerfrauen wurde von den Bayern-Bossen rasch erkannt und wird seither intensiv in das Coaching von Niko Kovač miteinbezogen. Völlig zu recht, denn seit dieser Maßnahme geht es mit dem Rekordmeister wieder steil bergauf!Bayern-Präsident Hoeneß: „Oben von der Tribüne bekommt man oftmals ein wesentlich besseres Bild vom Spiel als von der Seitenlinie. Die Lisa hat damals als einzige erkannt, dass eine Einwechslung von Thomas Müller dem Spiel eine entscheidende Wende geben würde.“ Hätte man auch noch auf die mahnende Stimme von Cathy Hummels gehört und die Abwehr sofort nach dem 1:0 der Bayern mit ihrem Gatten Mats verstärkt, wäre der Sieg eine ‚gmahde Wiesn‘ gewesen, so Hoeneß.Seither geht man in München in Sachen Coaching einen völlig neuen Weg: Die Spielerfrauen des FC Bayern stehen seit der 12. Runde während der Spiele mit Niko Kovač in ständigem Funkkontakt. Ihre Aufgabe ist es, den Trainer permanent mit taktischen Anweisungen zu versorgen und diesen insbesondere auf personelle Schwachstellen aufmerksam zu machen.Und damit den Bayern nach Seitenwechsel eine noch bessere Hälfte gelingt als in den ersten 45 Minuten, halten die ‚besseren Hälften‘ seither auch gleich die Pausenansprache! Im Unterschied zu Kovač, so Karl-Heinz Rummenigge, wüssten die Spielerfrauen nämlich ganz genau, ‚wieviel Anfeuerung, Schmeicheleinheiten und gelegentliche sanfte Kritik es bräuchte, um ihre Diven auf dem Spielfeld zum gewohnten Pflichtsieg zu führen‘.Der Erfolg gibt dem FC Bayern München recht: Seit dem 24. November gab es in acht Spielen sechs Siege, zwei Unentschieden und keine einzige Niederlage! Und damit es am Ende der Saison auch wieder wie gewohnt mit dem Meistertitel klappt, möchte man nun noch einen Schritt weitergehen: Ab dem neuen Jahr trainieren Lewandowski, Alaba & Co. gemeinsam mit der Damen-Mannschaft des FC Bayern. So soll der Rekordmeister endgültig zu alter Stärke zurückfinden. Die Konkurrenz kann sich jedenfalls schon einmal auf eine Bomben-Rückrunde der Münchner gefasst machen!",Sport,2018-12-23 00:00:00,Entenpost
235,Reichweite Satire-Portale: Entenpost verteidigt Platz 2,"Erfreuliches zum Jahresabschluss 2018 für die Entenpost-Redaktion: Bei der Reichweite österreichischer Satire-Portale landete Die Entenpost trotz steigender Konkurrenz auch heuer wieder hinter krone.at auf Platz 2. Gegenüber dem Drittplatzierten heute.at konnte der zweite Rang nicht nur verteidigt sondern der Vorsprung sogar leicht ausgebaut werden!Der Platzhirsch kronet.at liegt mit 30% (-2,1%) weiter unangefochten an der Spitze, hat jedoch zugunsten der bei Satire-Fans immer beliebter werdenden Portale unzensuriert.at (4%) und wochenblick.at (3%) Reichweite eingebüßt.Die Entenpost erzielte 2018 eine Reichweite von 22% (+1,2%) und lässt somit heute.at (19%) sowie oe24.at (13%) klar hinter sich. Beachtlich fällt die Reichweite des Sportpropheten aus, der es als Nischen-Satire-Medium immerhin auf 9% geschafft hat!Die Entenpost bedankt sich bei ihren potenziellen 8,82 Millionen österreichischen Leserinnen und Lesern für das täglich entgegengebrachte Vertrauen im abgelaufenen Jahr und bleibt in Zeiten von Fake News und alternativen Fakten auch weiterhin ihrem Motto ‚In Satira Veritas‘ mehr denn je treu!","Allgemein, Empfehlung",2018-12-22 00:00:00,Entenpost
236,Marilene: Neues Traumpaar Fischer-Manson?,"Aufatmen bei Helene Fischer-Fans: Liebeskummer und Herzschmerz nach der überraschenden Trennung von Langzeit-Partner Florian Silbereisen waren nur von kurzer Dauer, der Atemlos-Star hat offenbar bereits eine neue Liebe gefunden: Laut dem Gossip Magazin OK! handelt es sich dabei um den US-amerikanischen Sänger und Schauspieler Marilyn Manson. Nach Florene nun also Marilene?Gefunkt haben dürfte es bereits im Juni beim diesjährigen Nova Rock Festival im burgenländischen Nickelsdorf, bei dem Manson als einer der Headliner aufgetreten war. Kennengelernt hatten sich die beiden zuvor laut OK! über den gemeinsamen Freund und als Schockmaler bekannten Gottfried Helnwein, der immer wieder für Fischers Bühnenbilder und ihr Bühnen-Outfit verantwortlich zeichnete.Während das Gerücht über das neue Traumpaar ‚Marilene‘ von vielen Fans wohl erst verdaut werden muss, kommt dieser Schritt für einen Insider der Schlager-Branche nicht wirklich überraschend: „Wenn du diesem Albtraum irgendwie entkommen möchtest, ohne dabei draufzugehen und ohne auf Drogen zurückzugreifen, brauchst du privat ein echtes Kontrastprogramm. Nach 10 Jahren Silbereisen ist Marilyn wahrscheinlich genau der Richtige für Helene!“Dass Fischer abseits von der Bühne am liebsten Nine Inch Nails, Slayer oder eben Manson hört, mag für viele ihrer Fans einem kleinen Kultur-Schock gleichkommen. Doch für sie hat der Schlagerstar eine beruhigende Nachricht fürs neue Jahr: ‚Keine Sorge Leute: The show must go on!‘ Ob solo oder gemeinsam mit Manson und der neuen Kunstform ‚Schockschlager‘ wird sich zeigen.","Allgemein, Empfehlung",2018-12-21 00:00:00,Entenpost
237,Hazeh statt Christ­kind: FPÖ-Video löst Tumult in Kin­der­gar­ten aus,"Dramatische Szenen spielten sich heute Vormittag in einem Kindergarten in Wien Döbling ab! Nachdem ein Kind das Gerücht in Umlauf gebracht hatte, dass heuer ein Hazeh anstatt des Christkinds die Geschenke bringen würde und sich diese Hiobsbotschaft wie ein Lauffeuer in sämtlichen Kindergartengruppen verbreitet hatte, eskalierte die Situation: Es kam zu Schreiduellen samt Handgreiflichkeiten, kollektive Heulkrämpfe und zahlreiche völlig traumatisierte Kinder waren die Folge. Die Lage konnte erst durch das Hinzuziehen von Polizei, Rettung und psychologischen Hilfskräften zu Mittag wieder einigermaßen beruhigt werden.Kindergartenpädagogin Bianca P. schildert, wie der Tumult seinen Ausgang genommen habe: „Wir hatten Sitzkreis und ich wollte mit den Kindern gerade das Lied von der Weihnachtsbäckerei singen, als der kleine Harald mit der Nachricht herausplatzte, dass er seit gestern wisse, dass heuer nicht das Christkind die Geschenke bringen werde sondern ein Mann namens Hazeh!“Diese Nachricht habe bereits für blankes Entsetzen gesorgt, doch Klein-Harald habe noch nachgelegt, indem er behauptete, dieser Hazeh hätte auch keine rote Mütze und keinen langen weißen Bart und bringe lediglich eine beknackte Eule als Geschenk!Laut Kindergartenpädagoginnen gab es im Anschluss kein Halten mehr: Der gesamte bei den Kindern aufgestaute Vorweihnachtsstress dürfte sich mit einem Mal entladen haben, Schreiduelle zwischen verzweifelten Christkind-Befürwortern und Verfechtern des Hazeh lockten Kinder anderer Gruppen an, erste Fäuste flogen und die anschließenden kindergartenweiten Tumulte konnten von den Verantwortlichen alleine nicht mehr unter Kontrolle gebracht werden. Polizei, Rettung und der sozialpsychiatrische Notdienst wurden verständigt, erst nach Verabreichung von Hasch-Brownies konnte zu Mittag die Lage halbwegs beruhigt und die Kinder nach Hause geschickt werden.Derzeit werden im Kindergarten die Sachschäden begutachtet, die Einrichtung bleibt bis auf weiteres gesperrt. Um weiteren Schaden zu vermeiden, solle außerdem laut Kindergartenleiterin geprüft werden, ob nicht für ein YouTube-Video der FPÖ, in dem tatsächlich das Christkind geleugnet und durch einen HC ersetzt wurde, eine Löschung auf Grund des Tatbestandes der Kindesverhetzung erwirkt werden könne.",Politik,2018-12-19 00:00:00,Entenpost
238,Weihnachts-Bestseller: Die 150-Euro-Diät von Hartinger-Klein,"Die Weihnachts-Feiertage stehen unmittelbar bevor, und so mancher denkt jetzt schon mit Schrecken an all die Kilos, die Festtagsbraten, Kekse und diverse Verwandtenbesuche hinterlassen werden. Sollten Sie noch auf der Suche nach einem Last-Minute-Geschenk sein, dann könnte dieser Bestseller die ideale Lösung für Ihre Probleme sein: ‚Die 150-Euro-Diät‘ von Gesundheitsministerin Beate Hartinger-Klein!Die Hartinger-Klein-Diät, eine Low-Cost-Variante, besser bekannt unter dem Namen 150-Euro-Diät, kombiniert gleich mehrere Vorteile: Kompromisslos schnell, ohne Jo-Jo-Effekt – und sogar für MindestsicherungsbezieherInnen leistbar! Die Ernährungsexpertin und Überlebenskünstlerin Hartinger-Klein streicht letzteren Punkt im Vorwort zu ihrem Bestseller besonders hervor: „Als Gesundheitsministerin gilt mein Kampf natürlich in erster Linie der Volkskrankheit ‚Übergewicht‘. Doch ich bin nicht nur mit Leib und Seele Gesundheitsministerin sondern auch mit ganzer Leidenschaft Sozialministerin. Und deshalb war es mir bei meiner Diät besonders wichtig, dass diese sozial ausgewogen ist und sich diese auch die sozial Schwächsten in unserer Gesellschaft leisten können!“Das Neue und zugleich Geniale an der Hartinger-Klein-Diät: Man darf essen und trinken was man möchte! Einzige Bedingung: Die Kosten für Nahrung und Getränke dürfen im Monat 150€ nicht übersteigen! Wer gelegentlich im Supermarkt einkaufen geht, kann unschwer nachvollziehen, warum die Diät so rasch die Pfunde purzeln lässt – und man bereits nach 30 Tagen der Traumfigur beträchtlich nahe gerückt sein dürfte!Vergessen Sie ab sofort Low-Carb-Diät, Saftfasten & Co. – mit der 150-Euro-Diät haben Sie alles, was Sie zum Abnehmen brauchen! Zwar legen Sie für den bereits als ‚Buch des Jahres 2018‘ gehandelten Bestseller beachtliche – nomen est omen – 150 Euro ab, aber Sie werden diese einmalige Investition nicht bereuen. Ihr Körper und auch Ihr Geldbörsel werden es Ihnen über kurz oder lang danken!","Allgemein, Politik",2018-12-18 00:00:00,Entenpost
239,Online-Gigant bedankt sich bei Anti-Re­gier­ungs-De­mon­stran­ten,"Der Online-Riese Amazon hat sich auf seiner Homepage ‚herzlichst bei den offiziell rund 17.000 Wiener Anti-Regierungs-Demonstranten für ihre großartige Unterstützung des Unternehmens im diesjährigen Weihnachtsgeschäft‘ bedankt. Auch für die Regierung gab es lobende Worte.Man habe zwar auf etwas mehr Teilnehmer gehofft, und auch die Streckenführung des Wiener Demozugs hätte nach Meinung Amazons noch optimaler gestaltet werden können, doch im Großen und Ganzen sei man mit den dadurch erreichten Umsatzsteigerungen durchaus zufrieden, so der Online-Händler auf der Österreich-Ausgabe seiner Webseite.Doch auch für die türkis-blaue Regierung fand der Handels-Marktführer in seiner Aussendung lobende Worte: Diese habe auf Grund ihrer bisherigen Arbeit – allen voran mit dem Aushängeschild 12-Stunden-Tag – das gestrige Großereignis samt positiven Auswirkungen auf den Online-Handel erst möglich gemacht.Das Demonstrationsrecht sei wichtig und richtig, so Amazon. Und man ermuntere beide Seiten, nicht locker zu lassen und die bisherigen Aktivitäten noch weiter zu intensivieren. Der Wunsch des Tech-Giganten ans Christkind: Bereits kommenden Samstag ein neuerlicher Protestzug  – und zwar österreichweit!",Politik,2018-12-16 00:00:00,Entenpost
240,Situations­elas­tische Heimatliebe,"Steuertrickser Google, Amazon & Co. – und nunmehr Waldhäusl?! Das nennt sich dann wohl situationselastische Heimatliebe.",Politik,2018-12-13 00:00:00,Entenpost
